{
  "format": "neuroverse-domain-rules/2",
  "site": {
    "id": "tiny",
    "name": "Tiny site"
  },
  "kinds": [
    "robot"
  ],
  "authorities": [
    {
      "id": "high"
    },
    {
      "id": "low"
    }
  ],
  "actions": [
    {
      "id": "go",
      "kinds": [
        "robot"
      ],
      "tags": [
        "movement"
      ]
    },
    {
      "id": "look",
      "kinds": [
        "robot"
      ]
    }
  ],
  "areas": [
    {
      "id": "floor",
      "name": "Floor"
    },
    {
      "id": "yard",
      "name": "Yard",
      "tags": [
        "outside"
      ]
    }
  ],
  "roles": [
    {
      "id": "bot",
      "name": "Bot",
      "kind": "robot",
      "actions": [
        "go",
        "look"
      ]
    }
  ],
  "facts": [
    {
      "id": "people",
      "type": "number",
      "integer": true,
      "min": 0,
      "required": true
    },
    {
      "id": "load",
      "type": "number",
      "min": 0,
      "default": 0
    },
    {
      "id": "time",
      "type": "time",
      "required": true
    },
    {
      "id": "mode",
      "type": "enum",
      "values": [
        "a",
        "b",
        "c"
      ],
      "default": "a"
    },
    {
      "id": "alarm",
      "type": "boolean",
      "default": false
    },
    {
      "id": "day",
      "type": "day",
      "required": true
    },
    {
      "id": "speedAsked",
      "type": "number",
      "min": 0
    }
  ],
  "limits": [
    {
      "id": "speed",
      "unit": "m/s",
      "requestedFact": "speedAsked"
    }
  ],
  "tags": {
    "actions": [],
    "areas": [],
    "roles": []
  },
  "answers": {},
  "otherwise": "deny",
  "rules": [],
  "builtin": [
    {
      "id": "required_facts",
      "text": "Every fact a decision needs must be supplied and valid; a missing or invalid fact is never permission."
    },
    {
      "id": "area_declared",
      "text": "Only declared areas are governed; anything in an undeclared area is blocked."
    },
    {
      "id": "role_declared",
      "text": "Only declared roles may act; unknown roles are blocked."
    },
    {
      "id": "role_permits_action",
      "text": "A participant may only take actions its role lists."
    },
    {
      "id": "unknown_action",
      "text": "An action the rulebook does not know is denied, or waits for approval, as the rulebook says (otherwise)."
    }
  ],
  "findings": [],
  "fingerprint": "5ea861d027da0859"
}
